{"schema_version":"portrait-recipe/1.0","id":"recurring-questions","version":"1.0","title":"我反复在问的问题","purpose":"提炼长期重复出现且具有个人意义的问题，而非只统计关键词。","privacy":"public_candidate_after_calibration","dimensions":[{"id":"question-families","question":"哪些不同表述的用户问题指向同一个长期问题？","minimum_evidence":{"independent_contexts":4,"timespan_days":120,"seek_counterevidence":true}},{"id":"question-evolution","question":"这些问题的表述、边界或答案期待如何变化？","minimum_evidence":{"independent_contexts":3,"timespan_days":120,"seek_counterevidence":true}},{"id":"question-context","question":"这些问题通常在哪些工作、学习、创作或生活语境出现？","minimum_evidence":{"independent_contexts":3,"timespan_days":60,"seek_counterevidence":true}}],"output":{"private_sections":["问题家族","演变","出现语境","尚无结论的地方"],"public_forms":["share_card","story_angle","long_form"]}}
