{"schema_version":"portrait-recipe/1.0","id":"interest-evolution","version":"1.0","title":"兴趣与思想兔子洞地图","purpose":"呈现兴趣主题如何出现、连接、持续或转向。","privacy":"public_candidate_after_calibration","dimensions":[{"id":"theme-clusters","question":"哪些兴趣或知识主题在独立会话中持续出现？","minimum_evidence":{"independent_contexts":3,"timespan_days":90,"seek_counterevidence":true}},{"id":"bridges","question":"哪些主题经常被放在同一个问题、项目或学习目标中讨论？","minimum_evidence":{"independent_contexts":2,"timespan_days":30,"seek_counterevidence":true}},{"id":"trajectory","question":"主题呈现持续、上升、转向还是证据不足？","minimum_evidence":{"independent_contexts":3,"timespan_days":120,"seek_counterevidence":true}}],"output":{"private_sections":["兴趣星图","主题之间的桥","时间轨迹","局限"],"public_forms":["share_card","profile_section","long_form"]}}
