{"schema_version":"portrait-recipe/1.0","id":"year-in-review","version":"1.0","title":"年度版本说明","purpose":"在明确年份或十二个月范围内，识别有证据的关注点、变化与仍在继续的问题。","privacy":"public_candidate_after_calibration","dimensions":[{"id":"recurring-concerns","question":"哪些问题或主题跨独立情境反复出现？","minimum_evidence":{"independent_contexts":3,"timespan_days":60,"seek_counterevidence":true}},{"id":"change-over-time","question":"哪些关注点、方法或立场发生了可解释的变化？","minimum_evidence":{"independent_contexts":3,"timespan_days":90,"seek_counterevidence":true}},{"id":"open-loops","question":"哪些明确提出但尚未解决的问题持续存在？","minimum_evidence":{"independent_contexts":2,"timespan_days":30,"seek_counterevidence":true}}],"output":{"private_sections":["范围与局限","持续主题","可见变化","开放问题"],"public_forms":["share_card","long_form","profile_section"]}}
