{"schema_version":"portrait-recipe/1.0","id":"productive-contradictions","version":"1.0","title":"我的有趣矛盾","purpose":"寻找随情境变化的真实张力，不把矛盾误写为缺陷或心理诊断。","privacy":"public_candidate_after_calibration","dimensions":[{"id":"repeated-tensions","question":"哪些看似相反的偏好、方法或目标分别在独立情境中出现？","minimum_evidence":{"independent_contexts":4,"timespan_days":90,"seek_counterevidence":true}},{"id":"context-boundaries","question":"什么情境、目标或时间变化能解释这些张力？","minimum_evidence":{"independent_contexts":3,"timespan_days":60,"seek_counterevidence":true}},{"id":"generative-use","question":"这种张力是否带来了有用的选择、作品或学习？","minimum_evidence":{"independent_contexts":2,"timespan_days":30,"seek_counterevidence":true}}],"output":{"private_sections":["张力而非标签","情境解释","可能的生产力","反例与不确定性"],"public_forms":["share_card","story_angle","profile_section"]}}
