{"schema_version":"portrait-recipe/1.0","id":"working-style","version":"1.0","title":"个人工作与创作使用说明书","purpose":"描述可观察到的工作、学习和创作方式，不把它伪装成固定人格标签。","privacy":"public_candidate_after_calibration","dimensions":[{"id":"problem-framing","question":"用户通常如何把模糊问题变成可行动的问题？","minimum_evidence":{"independent_contexts":4,"timespan_days":90,"seek_counterevidence":true}},{"id":"learning-loop","question":"用户如何寻找例子、验证理解、修正方向或恢复推进？","minimum_evidence":{"independent_contexts":4,"timespan_days":90,"seek_counterevidence":true}},{"id":"collaboration-needs","question":"用户明确表达过哪些协作、反馈或工作环境偏好？","minimum_evidence":{"independent_contexts":2,"timespan_days":30,"seek_counterevidence":true}}],"output":{"private_sections":["可观察的工作方式","有效条件","反模式与边界","可校正的使用说明"],"public_forms":["share_card","profile_section","long_form"]}}
