{"schema_version":"portrait-recipe/1.0","id":"unfinished-work","version":"1.0","title":"我的未竟之书","purpose":"从反复出现的明确项目、创作意图或待解问题中找出值得回看的种子，不把计划当作完成事实。","privacy":"private_default","dimensions":[{"id":"returning-seeds","question":"哪些明确提出的项目、创作或研究想法在独立会话中多次返回？","minimum_evidence":{"independent_contexts":3,"timespan_days":90,"seek_counterevidence":true}},{"id":"progress-signals","question":"记录中有哪些明确的推进、暂停、放弃或重启信号？","minimum_evidence":{"independent_contexts":2,"timespan_days":30,"seek_counterevidence":true}},{"id":"next-context","question":"用户已陈述过哪些条件、资源或问题会影响下一步？","minimum_evidence":{"independent_contexts":2,"timespan_days":30,"seek_counterevidence":true}}],"output":{"private_sections":["反复返回的种子","进展信号","尚未解决的条件","可供用户选择的下一步"],"public_forms":["none","story_angle"]}}
